{"architectures":["MERTModel"],"canonical_weight_file":"pytorch_model.bin","config_class":"MERTConfig","config_sha256":"ea2627c4c7825cd66f3c944b6b966331604c35928174e0100cd4a82829424e32","custom_code_aggregate_sha256":"6f5980e11c3968aba34887379c5abf2c63ed5d3536e8996b721f797f7b29799c","custom_code_dependencies":{"configuration_MERT.py":["functools","operator","transformers.configuration_utils","transformers.utils"],"modeling_MERT.py":[".configuration_MERT","math","nnAudio","torch","transformers.modeling_outputs","transformers.models.hubert.modeling_hubert","typing"]},"declared_sample_rate_hz":24000,"environment_binding":{"huggingface_hub_version":"0.36.0","platform":"Windows-10-10.0.26100-SP0","python_version":"3.10.11","pytorch_version":"NOT_INSTALLED","transformers_version":"NOT_INSTALLED"},"files":[{"relative_path":"config.json","role":"MODEL_CONFIG","sha256":"ea2627c4c7825cd66f3c944b6b966331604c35928174e0100cd4a82829424e32","size_bytes":1817},{"relative_path":"configuration_MERT.py","role":"CUSTOM_CONFIGURATION_CODE","sha256":"ae0ec2bab8f59c724ba9878a7c20b67210189536ea62d34a56775968e9decb03","size_bytes":5340},{"relative_path":"modeling_MERT.py","role":"CUSTOM_MODELING_CODE","sha256":"6c3ee73cef6f0c30ef494f88d96f891fa6925ffe663fa391b512f4b57abecc6c","size_bytes":18033},{"relative_path":"preprocessor_config.json","role":"PREPROCESSOR_CONFIG","sha256":"cc5a5e4a5d3b1a758a5ed984b2eaa15bb0522d811d44a9eed82bfca4baa0dc8f","size_bytes":211},{"relative_path":"pytorch_model.bin","role":"CANONICAL_TRANSFORMERS_WEIGHT","sha256":"a2b8b747f72c06e0595aeae41ae5473f4364938c6b39b2c58be38c48e6bd3fcd","size_bytes":377552987}],"license":"cc-by-nc-4.0","loader_role":"TRANSFORMERS_AUTO_MODEL_LOCAL_PINNED","local_files_only_required":true,"model_class":"MERTModel","model_type":"mert_model","other_weight_files":{"MERT-v1-95M_fairseq.pt":"NOT_CONSUMED_BY_CANONICAL_TRANSFORMERS_LOADER"},"preprocessor_sha256":"cc5a5e4a5d3b1a758a5ed984b2eaa15bb0522d811d44a9eed82bfca4baa0dc8f","processor_class":"Wav2Vec2FeatureExtractor","repository_id":"m-a-p/MERT-v1-95M","revision":"12af15fef9d0ac838c3f475bfbbf26d2060dd4f5","schema_version":"1.0","semantic_identity_sha256":"341484e496d82b55422a638b10ad24ce2e5d1fa507627dad1c849049c9f7c39d","snapshot_aggregate_sha256":"07269a149bcedb98f6c0cd9bc11719c4e0571f06e4fe41599536cd180812b80c","snapshot_declared_transformers_version":"4.24.0","trust_remote_code_required":true,"upstream_model_id":"mert-v1-95m-primary-v1","weight_sha256":"a2b8b747f72c06e0595aeae41ae5473f4364938c6b39b2c58be38c48e6bd3fcd"}
